{
  "schema_version": "operator.routine_pack.v1",
  "pack_id": "routine-pack://life/household-family",
  "pack_version": "1.0.0",
  "status": "recommended",
  "domain_class": "life",
  "summary": "Household and family operations pack for shared commitments, recurring obligations, follow-through and exception-oriented administration.",
  "fit_signals": [
    "shared household commitments",
    "recurring bills or renewals",
    "maintenance or appointment logistics",
    "family coordination"
  ],
  "template_refs": [
    "routine-template://life/household-admin-review@1.0.0",
    "routine-template://cross-domain/follow-up@1.0.0",
    "routine-template://cross-domain/renewal-expiry@1.0.0",
    "routine-template://cross-domain/reconciliation@1.0.0",
    "routine-template://cross-domain/orientation@1.0.0"
  ],
  "composition": {
    "may_combine_with": [
      "routine-pack://life/personal-executive",
      "routine-pack://life/personal-finance",
      "routine-pack://life/wellness-care"
    ],
    "selection_rule": "Keep household/member data purpose-limited; use exception-oriented coordination rather than creating ambient surveillance or authority.",
    "archetype_not_identity": true
  },
  "privacy": {
    "contains_private_payload": false,
    "contains_secret_material": false
  }
}
