{
  "schema_version": "operator.routine_pack.v1",
  "pack_id": "routine-pack://business/professional-services",
  "pack_version": "1.0.0",
  "status": "recommended",
  "domain_class": "business",
  "summary": "Professional-services pack spanning inquiry, follow-up, delivery, reconciliation and renewals.",
  "fit_signals": [
    "client inquiries",
    "project delivery",
    "invoices",
    "renewals or recurring service",
    "owner-led follow-up"
  ],
  "template_refs": [
    "routine-template://business/inquiry-triage@1.0.0",
    "routine-template://cross-domain/follow-up@1.0.0",
    "routine-template://business/delivery-case-review@1.0.0",
    "routine-template://cross-domain/reconciliation@1.0.0",
    "routine-template://cross-domain/renewal-expiry@1.0.0"
  ],
  "composition": {
    "may_combine_with": [
      "routine-pack://business/founder-portfolio"
    ],
    "selection_rule": "Prefer event-driven intake/follow-up where source events exist; schedule reconciliation and review only where periodic closure is required.",
    "archetype_not_identity": true
  },
  "privacy": {
    "contains_private_payload": false,
    "contains_secret_material": false
  }
}
