{
  "schema_version": "operator.routine_pack.v1",
  "pack_id": "routine-pack://business/software-saas",
  "pack_version": "1.0.0",
  "status": "recommended",
  "domain_class": "business",
  "summary": "Software/SaaS pack for inquiry, delivery/support, systems exceptions, knowledge freshness and outcome review.",
  "fit_signals": [
    "software product",
    "customer support",
    "deployments",
    "runtime infrastructure",
    "release or entitlement operations"
  ],
  "template_refs": [
    "routine-template://business/inquiry-triage@1.0.0",
    "routine-template://business/delivery-case-review@1.0.0",
    "routine-template://business/system-health-exceptions@1.0.0",
    "routine-template://cross-domain/knowledge-freshness@1.0.0",
    "routine-template://cross-domain/reconciliation@1.0.0"
  ],
  "composition": {
    "may_combine_with": [
      "routine-pack://business/founder-portfolio"
    ],
    "selection_rule": "Keep service health distinct from accepted customer outcome; do not schedule duplicate monitors when product-native events exist.",
    "archetype_not_identity": true
  },
  "privacy": {
    "contains_private_payload": false,
    "contains_secret_material": false
  }
}
