{
  "schema_version": "operator.routine_pack.v1",
  "pack_id": "routine-pack://business/founder-portfolio",
  "pack_version": "1.1.0",
  "status": "recommended",
  "domain_class": "cross_domain",
  "summary": "Multi-business founder pack for portfolio orientation, shared financial truth, systems health, workforce allocation, receiver-side closure and Quiet Kaizen.",
  "fit_signals": [
    "multiple businesses",
    "shared infrastructure",
    "cross-business obligations",
    "owner as integration point"
  ],
  "template_refs": [
    "routine-template://cross-domain/orientation@1.0.0",
    "routine-template://cross-domain/reconciliation@1.0.0",
    "routine-template://business/system-health-exceptions@1.0.0",
    "routine-template://cross-domain/weekly-planning@1.0.0",
    "routine-template://cross-domain/knowledge-freshness@1.0.0",
    "routine-template://cross-domain/finance-operations@1.0.0",
    "routine-template://business/workforce-dispatch@1.0.0",
    "routine-template://cross-domain/evidence-closure@1.0.0",
    "routine-template://cross-domain/quiet-kaizen@1.0.0"
  ],
  "composition": {
    "may_combine_with": [
      "routine-pack://business/professional-services",
      "routine-pack://business/software-saas",
      "routine-pack://business/content-community",
      "routine-pack://life/personal-executive"
    ],
    "selection_rule": "Preserve per-business authority/data boundaries; shared routines may aggregate refs but must not merge canonical records.",
    "archetype_not_identity": true
  },
  "privacy": {
    "contains_private_payload": false,
    "contains_secret_material": false
  }
}
